{
  "meta": {
    "name": "Operational Context Graph Concept Dataset",
    "version": "1.0.0",
    "description": "Fictional, graph-ready dataset for a portfolio concept showing relationships across products, features, journeys, requirements, APIs, services, tests, defects, RCA, deployments, regions, languages, and AI capabilities.",
    "format": "nodes-links",
    "nodeCount": 73,
    "linkCount": 113,
    "isFictional": true
  },
  "nodeTypes": [
    "AICapability",
    "API",
    "Defect",
    "Deployment",
    "Feature",
    "Language",
    "Product",
    "RCA",
    "Region",
    "Requirement",
    "Screen",
    "Service",
    "TestCase",
    "TestSuite",
    "UserJourney"
  ],
  "edgeTypes": [
    "AFFECTS_SCREEN",
    "AVAILABLE_IN",
    "BACKED_BY",
    "CONSIDERS",
    "CONTAINS",
    "CONTEXTUALIZES_WITH",
    "CORRELATES_WITH",
    "DEPENDS_ON",
    "ENRICHES",
    "FAILED_ON",
    "GENERATES_FROM",
    "HAS_FEATURE",
    "HAS_RCA",
    "HAS_REQUIREMENT",
    "IMPLEMENTS_VIA",
    "INTRODUCED_IN",
    "INVESTIGATES",
    "LOOKS_BACK_TO",
    "RECOMMENDS_SIMILAR_TO",
    "RELATED_TO",
    "RELATES_TO",
    "SUPPORTED_LANGUAGE",
    "SUPPORTS_JOURNEY",
    "SURFACES",
    "USES_NODE_CLASS",
    "VALIDATED_BY"
  ],
  "nodes": [
    {
      "id": "product-alpha-suite",
      "label": "Alpha Suite",
      "type": "Product",
      "group": "product",
      "description": "Core platform product used in the concept model.",
      "status": "active",
      "priority": "high"
    },
    {
      "id": "product-orbit-mobile",
      "label": "Orbit Mobile",
      "type": "Product",
      "group": "product",
      "description": "Companion mobile product connected to shared services.",
      "status": "active",
      "priority": "medium"
    },
    {
      "id": "product-pulse-console",
      "label": "Pulse Console",
      "type": "Product",
      "group": "product",
      "description": "Operations console product for monitoring and triage flows.",
      "status": "active",
      "priority": "medium"
    },
    {
      "id": "feature-auth-session",
      "label": "Authentication & Session",
      "type": "Feature",
      "group": "feature",
      "productId": "product-alpha-suite",
      "description": "Login, token refresh, and session continuity."
    },
    {
      "id": "feature-alert-routing",
      "label": "Alert Routing",
      "type": "Feature",
      "group": "feature",
      "productId": "product-alpha-suite",
      "description": "Rule-based routing of operational alerts."
    },
    {
      "id": "feature-case-timeline",
      "label": "Case Timeline",
      "type": "Feature",
      "group": "feature",
      "productId": "product-pulse-console",
      "description": "Chronological event and activity view."
    },
    {
      "id": "feature-device-sync",
      "label": "Device Sync",
      "type": "Feature",
      "group": "feature",
      "productId": "product-orbit-mobile",
      "description": "Synchronization of assigned data to mobile clients."
    },
    {
      "id": "feature-report-export",
      "label": "Report Export",
      "type": "Feature",
      "group": "feature",
      "productId": "product-pulse-console",
      "description": "Export reports to document formats and download."
    },
    {
      "id": "feature-access-control",
      "label": "Access Control",
      "type": "Feature",
      "group": "feature",
      "productId": "product-alpha-suite",
      "description": "Role-based permissions and policy enforcement."
    },
    {
      "id": "journey-new-user-login",
      "label": "New User Login Journey",
      "type": "UserJourney",
      "group": "journey",
      "description": "First-time login from credential entry to dashboard."
    },
    {
      "id": "journey-alert-triage",
      "label": "Alert Triage Journey",
      "type": "UserJourney",
      "group": "journey",
      "description": "Review, assign, and escalate an incoming alert."
    },
    {
      "id": "journey-mobile-sync",
      "label": "Mobile Sync Journey",
      "type": "UserJourney",
      "group": "journey",
      "description": "Refresh assigned content on mobile under mixed connectivity."
    },
    {
      "id": "journey-report-download",
      "label": "Report Download Journey",
      "type": "UserJourney",
      "group": "journey",
      "description": "Generate and download a report with filters."
    },
    {
      "id": "req-auth-01",
      "label": "REQ-AUTH-01",
      "type": "Requirement",
      "group": "requirement",
      "summary": "System must lock session after repeated invalid login attempts.",
      "priority": "high"
    },
    {
      "id": "req-auth-02",
      "label": "REQ-AUTH-02",
      "type": "Requirement",
      "group": "requirement",
      "summary": "System must preserve session through token refresh without data loss.",
      "priority": "high"
    },
    {
      "id": "req-routing-01",
      "label": "REQ-ROUTE-01",
      "type": "Requirement",
      "group": "requirement",
      "summary": "Routing rules must prioritize critical alerts.",
      "priority": "high"
    },
    {
      "id": "req-routing-02",
      "label": "REQ-ROUTE-02",
      "type": "Requirement",
      "group": "requirement",
      "summary": "Escalation must notify the assigned owner when no handler accepts within SLA.",
      "priority": "medium"
    },
    {
      "id": "req-sync-01",
      "label": "REQ-SYNC-01",
      "type": "Requirement",
      "group": "requirement",
      "summary": "Mobile sync must resume after temporary connectivity loss.",
      "priority": "high"
    },
    {
      "id": "req-export-01",
      "label": "REQ-EXPORT-01",
      "type": "Requirement",
      "group": "requirement",
      "summary": "Generated exports must reflect active filters and selected date range.",
      "priority": "medium"
    },
    {
      "id": "req-access-01",
      "label": "REQ-ACCESS-01",
      "type": "Requirement",
      "group": "requirement",
      "summary": "Restricted views must be hidden from unauthorized roles.",
      "priority": "high"
    },
    {
      "id": "req-access-02",
      "label": "REQ-ACCESS-02",
      "type": "Requirement",
      "group": "requirement",
      "summary": "Role changes must take effect on next permissions refresh.",
      "priority": "medium"
    },
    {
      "id": "screen-login",
      "label": "Login Screen",
      "type": "Screen",
      "group": "screen"
    },
    {
      "id": "screen-dashboard",
      "label": "Dashboard",
      "type": "Screen",
      "group": "screen"
    },
    {
      "id": "screen-alert-board",
      "label": "Alert Board",
      "type": "Screen",
      "group": "screen"
    },
    {
      "id": "screen-case-detail",
      "label": "Case Detail",
      "type": "Screen",
      "group": "screen"
    },
    {
      "id": "screen-sync-center",
      "label": "Sync Center",
      "type": "Screen",
      "group": "screen"
    },
    {
      "id": "screen-report-builder",
      "label": "Report Builder",
      "type": "Screen",
      "group": "screen"
    },
    {
      "id": "screen-admin-access",
      "label": "Access Admin",
      "type": "Screen",
      "group": "screen"
    },
    {
      "id": "api-auth-service",
      "label": "Auth API",
      "type": "API",
      "group": "api",
      "methodSet": [
        "POST /login",
        "POST /refresh"
      ]
    },
    {
      "id": "api-alert-service",
      "label": "Alert API",
      "type": "API",
      "group": "api",
      "methodSet": [
        "GET /alerts",
        "POST /assign",
        "POST /escalate"
      ]
    },
    {
      "id": "api-sync-service",
      "label": "Sync API",
      "type": "API",
      "group": "api",
      "methodSet": [
        "POST /sync",
        "GET /delta"
      ]
    },
    {
      "id": "api-report-service",
      "label": "Report API",
      "type": "API",
      "group": "api",
      "methodSet": [
        "POST /generate",
        "GET /download"
      ]
    },
    {
      "id": "api-access-service",
      "label": "Access API",
      "type": "API",
      "group": "api",
      "methodSet": [
        "GET /roles",
        "POST /policy/evaluate"
      ]
    },
    {
      "id": "service-session-manager",
      "label": "Session Manager",
      "type": "Service",
      "group": "service"
    },
    {
      "id": "service-routing-engine",
      "label": "Routing Engine",
      "type": "Service",
      "group": "service"
    },
    {
      "id": "service-sync-orchestrator",
      "label": "Sync Orchestrator",
      "type": "Service",
      "group": "service"
    },
    {
      "id": "service-export-engine",
      "label": "Export Engine",
      "type": "Service",
      "group": "service"
    },
    {
      "id": "service-policy-engine",
      "label": "Policy Engine",
      "type": "Service",
      "group": "service"
    },
    {
      "id": "tc-auth-lockout",
      "label": "TC Auth Lockout After Invalid Attempts",
      "type": "TestCase",
      "group": "testcase",
      "automationStatus": "automated",
      "severity": "high"
    },
    {
      "id": "tc-auth-refresh",
      "label": "TC Session Refresh Preserves State",
      "type": "TestCase",
      "group": "testcase",
      "automationStatus": "automated",
      "severity": "high"
    },
    {
      "id": "tc-routing-priority",
      "label": "TC Critical Alert Priority Routing",
      "type": "TestCase",
      "group": "testcase",
      "automationStatus": "manual",
      "severity": "high"
    },
    {
      "id": "tc-routing-escalation",
      "label": "TC Escalation Notification After SLA Breach",
      "type": "TestCase",
      "group": "testcase",
      "automationStatus": "automated",
      "severity": "medium"
    },
    {
      "id": "tc-sync-resume",
      "label": "TC Sync Resume After Connectivity Loss",
      "type": "TestCase",
      "group": "testcase",
      "automationStatus": "automated",
      "severity": "high"
    },
    {
      "id": "tc-export-filters",